,teks,tipe
936,Bulan depan musim pancaroba \n Banyak hujan disertai badai \n Baiklah akan saya mencoba \n Tapi tak tau akan kapan dimulai,Pantun Berbalas
937,Jangan suka makan mentimun \n Mentimun itu banyak getah nya \n Jangan suka banyak melamun \n Melamun itu tiada gunanya,Pantun Nasihat
938,Jalan-jalan ke kota Padang \n Bersama adik dan juga abang \n Angin bertiup dengan sedang \n Layang-layang pastilah terbang,Pantun Anak-anak
939,Numpak andhong ning Kotagedhe \n tuku ali-ali kagem eyang putri \n Bilih aku nduwe luput gedhe \n nyuwun kawelasan sampean ampuni,Pantun Bahasa Jawa
940,Budak-budak ramai di pekan \n Hari raya membakar petas \n Kalau adik pandai kiasan \n Apakah buah gugur ke atas? (buah Melaka),Pantun Teka-Teki
941,Ngun Syah Betara Sakti \n Panahnya bernama Nila Gandi \n Bilanya emas banyak di peti \n Sembarang kerja boleh menjadi,Pantun Nasihat
942,Jalan-jalan ke rawa-rawa \n Jika capai duduk di pohon palem \n Geli hati menahan tawa \n Melihat katak memakai helm,Pantun Jenaka
943,Rumahmu dari kayu \n Atapnya dari jerami \n Rupamu sungguh ayu \n Tapi sayang jarang mandi,Pantun Jenaka
944,Sungguh indah bunga yang ditanam \n Pergi melihat bersama teman \n Mari kita menjaga kebersihan \n Kebersihan itu sebagian iman,Pantun Alam
945,Keris bertuah amat sakti \n Kalah oleh iman nan hakiki \n Apakah ciri cinta sejati \n Berani berkorban tak kenal henti,Pantun Cinta
946,Ada hiburan kuda kepang \n Penarinya sedang bergoyang \n Ayo kita ke tanah lapang \n Untuk bermain layang-layang,Pantun Anak-anak
947,Di mana kuang hendak bertelur \n Di atas lata di rongga batu \n Di mana tuan hendak tidur \n Di atas dada di rongga susu,Pantun Jenaka
948,Dua tiga kucing berlari \n Mana nak sama si kucing belang \n Dua tiga boleh ku cari \n Manakan sama Ayahku Sorang,Pantun Ayah
949,Berbuah lebat pohon mempelam \n Rasanya manis dimakan sedap \n Bersebarlah adat seluruh alam \n Adat pusaka berpedoman kitab,Pantun Adat
950,Dua musim dalam setahun \n Musim banjir air melimpah \n Uang kertas bukanlah daun \n Jangan dihambur seperti sampah,Pantun Pendidikan
951,Ning gunung ketur tuku bolah \n kanggo ndodomi sajadahe simbah \n Dudu salahmu sing gawe susah \n nafsu amarahku sing gawe bubrah,Pantun Bahasa Jawa
952,Ada terjemahan ke bahasa Melayu \n Mudah faham isi kandungannya \n Ibu yang ikut wahyu \n Jadilah anak didiknya berjaya,Pantun Ibu
953,"Berpohon bulat daunnya rindang \n Asam dan hijau kala muda \n Bentuknya ia bagai bintang \n Kalaupun masak, kuninglah ia? (Jawabannya: Belimbing)",Pantun Teka-Teki
954,Beli kentang dibuat rujak  \n Biar mantap dicampur sambal \n Tidur terlentang tidak nyenyak \n Tidur tengkurap ada yang mengganjal,Pantun Jenaka
955,Srengenge Idul Fitri anggawa pangarep-arep \n silaturahim kanggo lantaran rumakete ati \n Kita sedaya caos pangapura kanthi mantep \n nglaleake kalepatan liyan gawe tentreme ati,Pantun Bahasa Jawa
956,Dua tiga empat lima \n Enam tujuh delapan sembilan \n Kita hidup tak akan lama \n Jangan lupa siapkan bekalan,Pantun Agama
957,Warna putih bunga melati \n Tumbuh di kebun buah \n Usahamu disiplin setiap hari \n Ajari kami tanpa lelah,Pantun Guru
958,Masak angsa di kuali \n Bukan lagi di perigi \n Sebaiknya kamu mengabdi \n Di pangkuan ibu pertiwi,Pantun Pendidikan
959,Keliling kota naik becak \n meski lama tiada jemu \n Banyak-banyak engkau membaca \n Karena membaca kuncinya ilmu,Pantun Nasihat
960,Batang selasih permainan anak \n Tumbuhnya jarang di tepi telaga \n Bercerai kasih bukan kehendak \n Paksaan orang dituruti juga,Pantun Perpisahan
961,Langit mendung diatas lautan \n Lebat hujannya tiada terbendung \n Gadis berkerudung cantik menawan \n Kedip matanya rontokan bulu hidung,Pantun Jenaka
962,Anak ayam turunlah satu \n Mati satu tinggallah habis \n Tersiksa badan waktu itu \n Sebab mengikuti setan iblis,Pantun Agama
963,Dua tiga kucing berlari \n Mana makin sama si kucing belang \n Dua tiga boleh ku cari \n takkan sama hanya Ayahku S'orang,Pantun Ayah
964,Kisah Ariel Peterpan semakin hebat diperkata \n Edison Chen versi Indonesia \n Ayah oh Ayah semoga cepat sembuh dan ceria \n Kami sekeluarga merindui gelak dan tawa ayah semula,Pantun Ayah
965,Empat kali empat \n Sama dengan enam belas \n Cepat atau lambat \n Cintaku pasti kau balas,Pantun Jenaka
966,Tinggi gunung tak tergapai \n gunung biru jauh di seberang \n Kalau murid menjadi pandai \n hati gurupun ikut senang,Pantun Nasihat
967,"Di Indonesia ada Pulau Jawa \n Tak lupa juga ada Pulau Sumatera \n Guru, ajari kami dengan sukacita \n Agar kami mampu meraih cita-cita",Pantun Guru
968,Merantau ke sibu berjumpa kawan \n pantun di padu terjawap sopan \n walau bertemu hanya di awan \n namun rindu tetap tersimpan,Pantun Budi
969,Buah pisang buah tomat \n Disimpan didalam lumbung padi \n Pantas tercium bau menyengat \n Rupanya kau belum mandi,Pantun Jenaka
970,Pergi tamsya kekota Bogor \n Jangan lupa ke Kebun Raya \n Meski engkau sudah tersohor \n Janganlah lupa ayah ibunda,Pantun Pendidikan
971,Hari panas jangan ke laut \n Kalau ke laut kapal tergalang \n Hati panas jangan diturut \n Kalau diturut akal pun hilang,Pantun Nasihat
972,Kalau tuan pergi ke Tuban \n Jangan lupa mampir ke Daka \n Shalat itu perintah Tuhan \n Jika ingkar masuk neraka,Pantun Agama
973,Pergi ke hutan cari rusa \n Hendaklah kau bawa tali \n Wahai anak cucu bangsa \n Hendaklah kau bangun ngeri,Pantun Pendidikan
974,Segar pempek sebab cuka \n Lezat dan nikmat pasti rasanya \n Banyak orang yang suka \n Memang dia baik hatinya,Pantun Cinta
975,Sungguhlah besar taman Seri Mahkota \n Tempat bermain bidadari Lela Utama \n Sungguhlah benar bagi orang yang takwa \n Ada tempat yang aman dan bahagia,Pantun Agama
976,"Terkenang kembali saat gemilang \n Sahutan Merdeka !! berulang kali \n Impian seluruh rakyat terjulang \n Senyum di muka, Gembira di hati",Pantun Kemerdekaan
977,Ikan lohan \n di atas tungku \n Daripada duduk jauhan \n mendingan abang pangku,Pantun Cinta
978,Ke kota ngajar sihir \n meski belum mahir \n cinta ini takan berakhir \n meski hidup telah berakhir,Pantun Cinta
979,Terang bulan terang Cahaya \n Cahaya memancar ke Tanjung Jati \n Jika kau ingin hidup bahagia \n Beramal ibadah sebelum mati,Pantun Agama
980,Nemu gelang di pekarangan \n Tapi gelang sudah karatan \n Siapa nyampah sembarangan \n Pasti pacarnya orang utan,Pantun Jenaka
981,Nangka muda digulai lemak \n Buah beri masak tersangkut \n Harta dunia jangan ditamak \n Bila mati takkan mengikut,Pantun Agama
982,Pergi jalan-jalan \n jam 11 harus balik \n Ga ada penyesalan \n kamulah yang terbaik,Pantun Cinta
983,Makan lepas solat zohor \n Minum air dari labu \n Nama Shafie kekal masyhur \n Bimbingan awal dari ibu,Pantun Ibu
984,Rumah di kota amatlah bersih \n Tempat bermain si orang kaya \n Berpantang mata berasa kasih \n Jumpa yang lain lupakan saya,Pantun Cinta
985,Pohon selasih tumbuh melata \n Tumbuh perdu jauh di sana \n Sepasang kasih mabuk bercinta \n Siang merindu malam merana,Pantun Cinta
986,Begitu indah alam semesta \n Lebih indah dari mutiara \n Apakah tanda hatinya cinta \n Penuh kasih bersikap mesra,Pantun Cinta
987,Siang-siang minum es \n Minumnya sambil nonton upin ipin \n Kamu tau siapa itu orang sukses \n Sukses itu adalah orang-orang rajin,Pantun Bijak
988,Masak gulai sepikulan \n Enaknya tak ada lawan \n Lemah gemulai bila berjalan \n Dialah gadis yang menawan,Pantun Cinta
989,Rajut kain dengan benang \n Rajutnya oleh putri dayang \n Ayah pulang hatiku senang \n Wajah ibu juga kan riang,Pantun Anak-anak
990,Hari minggu mancing di kali \n di pinggiran melihat buaya \n Hidup di dunia hanya sekali \n maka jalani dengan sebaik-baiknya,Pantun Agama
991,Lebat daun bunga tanjung \n Berbau harum bunga cempaka \n Adat dijaga pusaka dijunjung \n Baru terpelihara adat pusaka,Pantun Adat
992,Apa guna pergi mengaji \n kalau tidak pakai peci \n apa guna anda berjanji \n kalau tidak ditepati,Pantun Budi
993,buah salak baru dipetik \n buah dukuh buah delima \n ada banyak wanita cantik \n cuma kamu yg aku cinta,Pantun Cinta
994,Daun terap di atas dulang \n Anak udang mati di tuba \n Dalam kitab ada terlarang \n Yang haram jangan dicoba,Pantun Agama
995,Papan rengat dari rawa \n semua orang ingin membawa \n Cintamu hangat di dalam jiwa \n saperti cahaya dari sang surya,Pantun Cinta
996,Sayang rindu terbiar sakitan \n pipi basah melurut rintisan \n Terbayang wajah sesegar ingatan \n Rindu ayah bersalut tangisan,Pantun Ayah
997,"Pisau tajam, pisau belati \n Jangan tertipu pisau palsu \n Cinta sejati timbul dari hati \n Bukan timbul dari nafsu",Pantun Cinta
998,Gadis Aceh berhati gundah \n Menanti teruna menghulur tepak \n Gula manis sirih menyembah \n Adat dijunjung dipinggir tidak,Pantun Adat
999,Pergi ke pasar membeli Kepah \n Untuk dimasak sambal pedas \n Terima Kasih buat Ayah \n Kasih dan sayangmu hanya Tuhan yg mampu membalas,Pantun Ayah
1000,Bunga cina di atas batu \n Daunnya lepas ke dalam ruang \n Adat budaya tidak berlaku \n Sebabnya emas budi terbuang,Pantun Budi
1001,Minum air dari labu \n Boleh dibawa bila berjalan \n Bimbingan awal dari ibu \n Serta kasih yang berkekalan,Pantun Ibu
1002,Gagang golokgagang cangkul \n Gagang cangkul juga gagang celurit \n Ga bisa nyolok katanya tumpul \n Biarpun tumpul tetep hasilnya buncit?,Pantun Jenaka
1003,Anak angsa mati lemas \n Mati lemas di air masin \n Hilang bahasa karena emas \n Hilang budi karena miskin,Pantun Budi
1004,Badan siapa terkena kudis \n Obati saja dengan lada \n Siang malam merayu gadis \n Duduk bersanding bersama janda,Pantun Jenaka
1005,Kemuning daunnya lampai \n Tubuh dijirat paduka tuan \n Diatas dunia kaul tak sampai \n Didalam surga ada penantian,Pantun Agama
1006,Memasak ikan di dalam peti \n Paling enak di campur terasi \n Gayanya aja kayak selebriti \n Tapi dompetnya kagak berisi,Pantun Jenaka
1007,Habis mandi pergi ke Mushola \n Mushola tempat tuk mengaji \n Guru ikhlas ajari kita \n Bertubi-tubi sampai kita pandai,Pantun Guru
1008,Hormatilah seorang guru \n Agar ilmu menjadi bermanfaat \n Ikhlaslah dalam mencari ilmu \n Insyaallah kau kan bermartabat,Pantun Bijak
1009,Kemumu di dalam semak \n Jatuh sehelai selarasnya \n Meski ilmu setinggi tegak \n Tak sembahyang apa gunanya,Pantun Agama
1010,Bila todak melanda Singapura \n Habis dikerat dicincang lumat \n Bila khianat pada manusia \n Dunia akhirat takkan selamat,Pantun Agama
1011,Boleh dibawa bila berjalan \n Kitab Shafie berjudul Risalah \n Serta kasih yang berkekalan \n Kuat hubungan dengan Allah,Pantun Ibu
1012,Lebat daun bunga tanjung \n Berbau harum bunga cempaka \n Adat dijaga pusaka dijunjung \n Baru terpelihara adat pesaka,Pantun Adat
1013,Setiap berkata gunakan otak \n Otak berfikir demi pengetahuan \n Sama-sama bibir bergerak \n Pilihlah kata yang menyenagkan,Pantun Pendidikan
1014,Tanam ubi tanam tebu \n Tanam pula di tepi paya \n Terima kasih kepada ibu \n Membesarkan kita hingga berjaya,Pantun Ibu
1015,Arjuna satria pandai memanah \n dari negeri antah berantah \n Agar rumah tangga sakinah \n taat pada apa yang diperintah,Pantun Cinta
1016,Di pinggir kolam makan bubur \n Jangan lupa pakai keripik \n Dari semalem aye ga bisa tidur \n Selalu teringat wajah mu yang cantik,Pantun Jenaka
1017,Tupai lompat mencuri kentang \n kentang habis tinggalah ikan \n Sholat magrib waktu petang \n jangan pernah kau tinggalkan,Pantun Nasihat
1018,Lembayung di antara semak \n Jatuh melayang ke dalam paya \n Walau ilmu setinggi tegak \n Tidak sembahyang apa gunanya,Pantun Agama
1019,Pergi ke sawah membawa cangkul \n Membawa bekal semangkok soto \n Jika kamu merasa anak gaul \n Apa bahasa inggrisnya nenek - nenek salto ? ( Jawabannya : Believe it or not ),Pantun Teka-Teki
1020,Buah apel berwarna merah \n Ketika digidit renyah sekali \n Hasil kita bersusah payah \n Menjaga kesehatan yang hakiki,Pantun Berbalas
1021,Buah nanas buah naga \n Enak disantap dikala senja \n Dikala muda sudah terbiasa \n Saat menua merasakan hasilnya,Pantun Berbalas
1022,Kain tenun dari sumbawa \n Kain batik dari pekalongan \n Kalau ingin jadi mahasiswa \n Sekolah Dasar jangan diabaikan,Pantun Pendidikan
1023,Dulang bukan sembarang dulang \n Dulang besar melebihi rantang \n Bolang bukan sembarang bolang \n Bolang berani menyerah pantang,Pantun Anak-anak
1024,Hujan gerimis deraslah amat \n Ada kilat bertabrakan \n Hari kamis malam jumat \n Yang mau kumat dipersilahkan,Pantun Jenaka
1025,Anak kecil berkepang pita \n Hendak berangkat main ke kota \n Padamu aku jatuh cinta \n Siang malam tampak di mata,Pantun Cinta
1026,Kadang salah kadang benar \n Kadang terang kadang bunar \n Rajinlah belajar \n Agar kamu menjadi pintar,Pantun Bijak
1027,Tukang bakso berbaju biru \n Sedang keliling kampung berjualan \n Justru kamu sebagai orang baru \n Mulai menyapa untuk berkenalan,Pantun Berbalas
1028,Naik delman ditarik kuda \n Melewati desa dan rawa-rawa \n Harta tak dibawa saat kau tiada \n Amal Sholeh yang akan kau bawa,Pantun Agama
1029,Asam kandis asam gelugur \n Kedua ayam si riang-riang \n Menangis mayat di pintu kubur \n Teringat badan tidak sembahyang,Pantun Agama
1030,Jikalau tuan tajuk cendana \n Ambil gantang jemurkan pala \n Jikalau tuan memang bijaksana \n Binatang apa ekor di kepala? (Jawabannya: Gajah),Pantun Teka-Teki
1031,Boleh masak gulai lemak \n Makan lepas solat zohor \n Kesan tarbiyah oleh ulamak \n Nama Shafie kekal masyhur,Pantun Ibu
1032,Redup bulan nampak akan hujan \n Pasang pelita sampai berjelaga \n Hidup mati di tangan Tuhan \n Tiada siapa dapat menduga,Pantun Agama
1033,Orang dahulu hidup di goa \n Biawak hidup di dalam rawa \n Ikuti perintah orang tua \n Tiap solat tak lupa berdoa,Pantun Nasihat
1034,Ikan gabus di rawa-rawa \n Ikan belut nyangkut di jaring \n Perutku sakit menahan tawa \n Gigi palsu loncat ke piring,Pantun Jenaka
1035,Membentang luas langit biru \n langit senja bagai perunggu \n Solat subuh harus diburu \n pahala besar selalu menunggu,Pantun Nasihat
1036,Monyet berlari mengejar kamu \n Berlari menabrak pintu \n Kutuntut ilmi dari guruku \n Untuk meraih cita-citaku,Pantun Guru
1037,Soimah Bersama anak laki-laki \n Duduk makan keropok lekor \n Yang mengejar tak berkaki \n Yang dikejar tak ber ekor? (Jawabnya: Ular dan Katak),Pantun Teka-Teki
1038,Jangan suka bermain tali \n Kalau tak ingin terikat olehnya \n Putus cinta jangan disesali \n Pasti kan datang cinta yang lainnya,Pantun Cinta
1039,Kalau memagar rumpun bawang \n Pagar dahulu lapis berlapis \n Kalau mendengar pengaduan orang \n Dengarkan dulu habis-habis,Pantun Nasihat
1040,Sarat perahu muat pinang \n Singgah berlabuh di Kuala Daik \n Jahat berlaku lagi dikenang \n Inikan pula budi yang baik,Pantun Budi
1041,Tuan puteri belajar menari \n Tari diajar oleh Pak Harun \n Kalau Tuan bijak bestari \n Apa yang naik tak pernah turun? (umur),Pantun Teka-Teki
1042,Meski dibungkus bukan kiriman \n Sudah takdir Allah yang satu \n Walau ditanam bukan tanaman \n Cobalah terka apakah itu? (Jawabannya: Mayat/jenazah),Pantun Teka-Teki
1043,Ada burung cendrawasih \n makan duku sampe  modar \n percayalah kasih \n kasih sayangku takkan pernah pudar,Pantun Cinta
1044,"Gunung Merapi, Gunung Merbabu \n tansah jejer kaya sedulur kembar \n Aku sing wis tau nglaraake atimu \n njaluk samudra pangapuramu kang jembar",Pantun Bahasa Jawa
1045,Jangan suka mencabut padi \n Kalau dicabut hilang buahnya \n Jangan suka menyebut budi \n Kalau disebut hilang tuahnya,Pantun Nasihat
1046,Sepah tebu rasanya hambar \n Bila dibakar pasti berkobar \n Jika engkau slalu bersabar \n Ilmumu pasti kan lebar,Pantun Nasihat
1047,Ikan duyung ikan sapu \n Burung irian burung cendrawasih \n Itulah pantun lucu dariku \n Cukup sekian dan terima kasih,Pantun Jenaka
1048,jangan suka makan mentimun \n karna banyak getahnya \n hai kawan jangan melamun \n melamun itu tak ada gunanya,Pantun Jenaka
1049,Terang bulan indah bercahaya \n Cahaya memancar ke Tanjung Jati \n Jika engkau hendak bahagia \n Beramal Ibadat sebelum mati,Pantun Agama
1050,Beli penggaris dari mika \n Cicak menatap hati merenung \n Kemana yang kamu suka \n Liburan ke pantai atau gunung,Pantun Anak-anak
1051,Kolang kaling es kelapa \n Campur sedikit daun bidara \n Ayah pulang bawa apa \n Pastilah Ayah bawa gembira,Pantun Anak-anak
1052,Pagi-pagi baca koran \n Semoga saja kamu kurang \n Jangan lupa baca Al-Quran \n Semoga saja harimu terang,Pantun Bijak
1053,Kursi kuat dari kayu jati \n Membelinya di sukarame \n Jika kau permpuan sejati \n Alis - alis apa yang bikin rame ? ( Jawabannya : Alisan ibu - ibu ),Pantun Teka-Teki
1054,Jalan-jalan ke Kota Blitar \n jangan lupa beli sukun \n Jika kamu ingin pintar \n Belajarlah dengan tekun,Pantun Nasihat
1055,"Ke jakarta naiklah pesawat \n Pesawat terbang, landingnya susah \n Kalau cinta sudah melekat \n Siang terbayang, malam mimpi basah",Pantun Jenaka
1056,Sang saka merah putih berkibar bebas \n Karena pahlawan-pahlawan yang ikhlas \n Memperjuangkan Indonesea agar terlepas \n Dari penjajah yang sadis dan pemeras,Pantun Kemerdekaan
1057,Pagi hari ditemani sang surya \n Hangat tubuh karna sinarnya \n Belajarlah setinggi-tingginya \n Lalu pulanglah berdakwah sesama,Pantun Bijak
1058,Pohon jati kuat kayunya \n Pohon kapuk tinggi batangnya \n Murid rajin banyak ilmunya \n Murid malas banyak bohongnya,Pantun Pendidikan
1059,Pasar baru pusatnya kain \n Awas dompet jangan hilang \n Desa tempatnya bermain \n Bagai bolang berpetualang,Pantun Anak-anak
1060,Anak itik mulailah terbang \n Ambilkan dedak berilah makan \n Janganlah adik merasa bimbang \n Segala kehendak abang tunaikan,Pantun Cinta
1061,Waktu daftar hari terakhir \n waktu terasa banyak terbuang \n Kamu nggak perlu khawatir \n cintaku hanya untukmu seorang,
1062,Api kecil dari tungku \n apinya kecil habis kayu \n Sudah lama kutunggu-tunggu \n kapan kamu bilang I love you,
1063,"Ayam goreng setengah mateng \n belinya di depan tugu \n Abang sayang, abangku ganteng \n Neng di sini setia menunggu",
1064,Jalanan lagi lancar \n itu adalah sebuah berkah \n Aku bukan nyari pacar \n tapi nyari yang mau diajak nikah,
1065,Minum sekoteng hangat rasanya \n minum segelas ada yang minta \n Laki-laki ganteng siapa yang punya? \n Bolehkah aku jatuh cinta,
1066,Bagaimana memanjat pohon randu? \n Tangan di atas kaki ke hulu \n Bagaimana hati tak rindu? \n Pacarnya lembut suka melucu,
1067,Paling banyak burung gelatik \n di atas terbang melayang \n Memang banyak wanita cantik \n cuma engkau yang aku sayang,
1068,Seribu bebek di kandang singa \n hanya satu berwarna belang \n Beribu cewek di Indonesia \n hanya engkau yang aku sayang,
1069,Bawa paku dipukul batu \n dicampur jamu di atas tungku \n Cintaku cukuplah satu \n untuk kamu sepanjang waktu,
1070,Air mawar di dalam cangkir \n disimpan kendi di bawah parang \n Sedari awal hinggalah akhir \n sayangku tercurah untukmu seorang,
1071,Sapu rumah hingga bersih \n atapnya satu dibawa pergi \n Tatap mataku wahai kekaih \n cintaku satu tak terbagi-bagi,
1072,Daging ayam dibuat gulai \n buat dimakan kita nanti \n Dirimu seorang yang ternilai \n takkan pernah bisa diganti,
1073,Tak usah menggurui \n dia itu kepala suku \n Perlu kamu ketahui \n kamu adalah semangat hidupku,
1074,Air arak diharamkan \n karenanya banyak nyawa melayang \n Meskipun jarak memisahkan \n semua itu bukan penghalang,
1075,Jalan  jalan ke Kota Ratu \n beli roti berisi bulu \n Mari cantik kita bersatu \n menjalin cinta di depan penghulu,
1076,Langit biru terlihat sendu \n warna hijau biru dan semu \n Jarak jauh tumbuhkan rindu \n ingin selalu dekat denganmu,
1077,Berlabuh orang menunggu \n hendak berlayar ke Siantar \n Kalau jauh terasa rindu \n jika berjumpa terasa sebentar,
1078,Patah dahan disambungkan \n hendak hati disatukan \n Kepada Tuhan kita mohonkan \n agar cepat dipertemukan,
1079,Meski hanya sebuah jambu \n tetap bisa dibuat jamu \n Meski jarang kita bertemu \n cintaku tetap hanya untukmu,
1080,Jikalau ikan di dalam kolam \n bunganya tumbuh di tengah taman \n Jikalau cintaku sudah mendalam \n jaraknya jauh tak ku hiraukan,
1081,Wahai seruling buluh perindu \n suaranya memikatku \n Wahai gadis pujaanku \n aku sangat cinta kamu,
1082,Ada ayam ada itik \n Berjalan sambil mengangguk-angguk \n Selamat malam wanita cantik \n Kenalan yuuk,
1083,Jilbab putih dan abu-abu \n Dipakai dengan indahnya gamis \n Bolehkah ku tahu namamu \n Untuk kamu yang senyumnya manis,
1084,Jalan ke medan berliku-liku \n Tapi tidak ada begal \n Nasib ke depan tak ada yang tahu \n Alangkah baiknya kita saling mengenal,
1085,Orang itu bukanlah hantu \n tapi orang itu adalah tamu \n Aku ingin menjadi kunci pintu \n supaya aku dapat membuka pintu hatimu,
1086,Barang itu adalah barang yang antik \n tadi penjual barang antik tersebut datang kesini bertamu \n Berjuta-juta wanita yang cantik \n tiada wanita cantik selain dirimu,
1087,Laki-laki itu bukan saya \n tetapi itu adalah sahabatku \n Bapak kamu seorang pencuri ya \n soalnya kau telah mencuri hatiku,
1088,Aku itu sulit dalam menghafal \n soalnya aku males baca buku \n Kau bagaikan sebuah kapal \n yang berlabuh di hatiku,
1089,Buat sangkar harus pakai paku \n sebelum buat sangkar enaknya minum jamu \n Tidak ada wanita lain di hatiku \n karena hatiku hanya untukmu,
1090,Makanan busuk memang bau \n bila dimakan rasanya pahit seperti jamu \n Sebenarnya ku ingin kau tau \n aku tak bisa hidup tanpa cintamu,
1091,Naruh uang di dalam saku \n sakunya sobek gara-gara kena kuku \n Jangan sampai kau mengkhianatiku \n karena hanya dirimu yang ada di hatiku,
1092,Punya istri cuma satu \n dia malah seorang penjual jamu \n Aku ingin ungkapkan sesuatu \n yaitu aku ingin mendapatkan cinta yang tulus darimu,
1093,Makan ayam lalapannya kemangi \n tetapi jangan lupa bersihin kuku \n Tak ada wanita lain yang aku sayangi \n hanya kamulah wanita yang mengisi hatiku,
1094,Ibu-ibu sukanya ngebatik \n kalau bapak-bapak sukanya rebana \n kau wanita yang paling cantik \n yang dapat membuatku terpana,
1095,Kau seperti sekuter matic \n yang sering dinaiki si Nita \n Bagiku kau wanita cantik \n yang dapat membuat semua laki-laki jatuh cinta,
1096,Udah bikin janji malah lupa \n tapi aku tidak akan lupa dengan cita-cita \n Aku memang tidak bisa memberimu apa-apa \n karena yang bisa ku beri hanya kasih sayang dan cinta,
1097,Ku ajak pergi ke pantai kau tidak mau \n soalnya aku ingin berdua denganmu \n Saat ini yang perlu kau tau \n ku tak bisa hidup tanpa dirimu,
1098,Buah salak buah duku \n tidak bisa dibuat jamu \n Bila kau belah dadaku \n akan kau temukan tulisan namamu,
1099,Pagi-pagi enaknya makan roti \n karena setelah itu harus pergi menuntut ilmu \n Kamu jangan berkecil hati \n karena hatiku hanya untukmu,
1100,Cinta itu bermula dari mata \n dan terkadang tertulis sampai ke buku \n Kau bagaikan nelayan cinta \n yang selalu menebar benih-benih cinta di hatiku,
1101,Lihat Messi mencetak gol \n tiba-tiba datang seorang tamu \n Aku ingin menjadi borgol \n supaya dapat memborgol cintamu,
1102,Kemarin aku habis dilempar batu \n ternyata yang nglembar batu itu ikan hiu \n Sebenarnya aku ingin katakan sesuatu \n yaitu I love you,
1103,Ada wanita yang rambutnya sebahu \n ternyata dia seorang penjual jamu \n Hari ini kau harus tahu \n aku tak bisa hidup tanpa cintamu,
1104,Kalau nembak cewek jangan pakai senapan \n berilah dia buah duren \n Aku memang bukan orang yang tampan \n tetapi aku imut-imut dan keren,
1105,Hobiku itu menyelam \n ketika menyelam pasti aku mengajak teman minimal satu \n Aku ingin sekali kamu tenggelam \n tenggelam di dalam hatiku,
1106,Naik motor sama mama papa \n pakainya motor matik \n Eeee tadi aku pikir siapa \n Ternyata adinda yang cantik,
1107,Gula pasir lebih manis gula jawa \n buah mahoni lebih pahit dari jamu \n Hatiku ini takkan mendua \n karena hati ini telah jadi milikmu,
1108,Jalan-jalan ke negara Inggris \n banyak gedung berbaris-baris \n Aku rela ditusuk ditusuk keris \n demi cintakmu kepada Adinda yang manis,
1109,Bunga itu bunga mawar \n sering ditaruh sebagai hiasan saku \n Aku ingin menjadi trotoar \n supaya kau dapat berjalan dengan mudah ke hatiku,
1110,Air itu suka diobaok-obok \n habis diobok-obok terus diminumkan ke sapi \n Habis mandi langsung bobok \n supaya bisa cepet ketemu kamu di dalam mimpi,
1111,Manusia dibagi menjadi dua jenis \n serta ada yang muda dan ada yang tua \n Kau hari ini tambak begitu manis \n sampai-sampai melebihi manisnya Gita Gutawa,
1112,Tubuhmu begitu lentik \n pasti kamu sering minum jamu \n Bagi oranglain mungkin kau tidak terlalu cantik \n tapi bagiku tidak ada yang secantik dirimu,
1113,Bagiku kau itu setangkai kembang \n kembang yang tak akan pernah jemu \n Aku ingin menjadi kumbang \n supaya bisa sering hinggap di pelukmu,
1114,Jalan-jalan pakai motor matik \n sambil bawa bekal telur dadar \n Kau hari ini tampak begitu cantik \n sampai melebihi Jesika Iskandar,
1115,Makan nasi sama sekoteng \n minumnya minum jamu \n Aku memang bukan orang ganteng \n tapi hatiku ini tulus untukmu,
1116,Sebelum berangkat belanja \n Olahraga terlebih dahulu supaya sehat \n Jika sudah terlalu lama bekerja \n Badan butuh istirahat,
1117,Jalan-jalan ke Bekasi \n Beli odeng lima ribuan \n Jangan lupa makan-makanan bergizi \n Untuk menjaga kesehatan,
1118,Pergi berlibur ke rumah paman \n Sekalian belajar budaya dan tari \n Tidak ada yang lebih nyaman \n Selain jaga kesehatan diri,
1119,Ke pasar beli kapur barus \n Pulang ke rumah lewat jalan lurus \n Jaga jarak itu harus \n Virus jadi kabur terus,
1120,Beli buah di pasar minggu \n Jangan lupa membeli duku \n Jangan lupa olahraga selalu \n Agar bahagia hadir selalu,
1121,"Pamanku seorang petani \n Punya kebun, punya ladang \n Ayo, membaca buku hari ini \n Supaya masa depan menjadi lebih gemilang",
1122,Di sekolah ada pemuda tampan \n Berangkat pagi jadi tergesa-gesa \n Jika menunda-nunda pekerjaan \n Hanya kata terlambat yang akan tersisa,
1123,Bangun rumah dengan batu bata \n Akan banyak pengeluaran yang muncul \n Apapun yang menjadi cita-cita kita \n Semoga kelak bisa terkabul,
