,teks,tipe
749,Di pinggir kolam makan bubur \n Jangan lupa pakai keripik \n Dari semalem aku ga bisa tidur \n Selalu teringat wajah mu yg cantik,Pantun Cinta
750,Hayam Wuruk raja termahsyur \n Gajah Mada pemersatu Bangsa \n Cinta ilmu sepanjang umur \n Cinta bangsa sepanjang masa,Pantun Pendidikan
751,Beribu-ribu kain batik \n Hanya satu yang tertimpa pena \n Beribu-ribu gadis cantik \n Cuma dirimu yang mempesona,Pantun Cinta
752,Beli kain warna nya merah \n Dari kediri pake nya batik \n Di godain jangan marah \n Salah sendiri punya wajah cantik,Pantun Cinta
753,Nasi uduk masih anget \n Beli nye di pinggir jalan \n Yang lagi duduk manis banget \n Boleh ga kite kenalan,Pantun Cinta
754,Jalan-jalan ke gunung salak \n Jangan lupa membeli kemiri \n Kalau bumi kita rusak \n Pasti kita yang akan merugi,Pantun Alam
755,Bila tuan tajuk cendana \n Ambil padi sukatkan padi \n Bila tuan memang bijaksana \n Binatang apa bertanduk di kaki? (Jawabnya: Ayam jantan),Pantun Teka-Teki
756,Kalau kamu membeli tikar \n Tikar terbuat dari mengkuang \n Kalau kamu memang pintar \n Ular apa yang melilit pinggang? (Jawabannya: Ikat Pinggang),Pantun Teka-Teki
757,Pergi bertemu si pandai besi \n Dia mengasah pedang biasa \n Dicari-cari sulit sekali \n Andai ketemu dibuang ia? (Jawabannya: Upil),Pantun Teka-Teki
758,Air jeruk dalam kulkas \n makan roti dengan keju \n Niatlah belajar dengan ikhlas \n hanya Allah yang dituju,Pantun Nasihat
759,Rintik rintik turun hujan \n Masuk kamar sama teman \n Gadis cantik jadi pujaan \n Mau dilamar kok hamil duluan,Pantun Jenaka
760,Burung nuri burung dara \n Terbang ke sisi taman kayangan \n Cubalah teka wahai saudara \n Semakin diisi makin ringan? (belon),Pantun Teka-Teki
761,Apa tanda orang istana \n semua barang selalu baru \n Apa tanda tumbuh cinta \n terasa di dada rasa cemburu,Pantun Cinta
762,Kue rangin rasanya manis \n Kue tar bukanlah lapis \n Malam dingin hujan gerimis \n Sebentar bentar kebelet pipis,Pantun Jenaka
763,Bunga disiram takkan layu \n Slalu berbunga tiada jemu \n Jangan takut kehilanganku \n aku tak akan pergi darimu,Pantun Cinta
764,Sakit kaki merah mamar \n pagie berobat k urang paloh \n mcm mne gtok e nk melamar \n sigek padi pun daan betaroh,Pantun Budi
765,Di antara padi dengan selasih \n Yang mana satu tuan luruh kan \n Di antaracbudi dengan kasih \n Yang mana satu tuan turutkan,Pantun Budi
766,Orang Sasak pergi ke Bali \n Membawa pelita semuanya \n Berbisik pekak dengan tuli \n Tertawa si buta melihatnya,Pantun Jenaka
767,Kera di hutan cekat melompat \n Si pemburu memasang jerat \n Hina sangat sifat mengumpat \n Dilaknat Allah dunia akhirat,Pantun Agama
768,Mudah pula mengail ikan \n Ada haruan dan sepat \n Dengan ilmu terus diamalkan \n Betul aqidah pahalapun dapat,Pantun Ibu
769,Melihat berita yang sedang tayang \n Beritanya tentang sebuah penelitian  \n Cinta bukanlah sekedar kasih sayang \n Melainkan sejauh mana sebuah kesetiaan,Pantun Cinta
770,Buah budi bidara mengkal \n Masak sebiji di tepi pantai \n Hilang budi bicara akal \n Buah apa tidak bertangkai? (buah hati),Pantun Teka-Teki
771,Good morning \n Selamat pagi \n Gigi kuning \n Ga pernah gosok gigi,Pantun Jenaka
772,Hari minggu sudahlah siang \n Setelah siang datanglah petang \n Ditunggu tunggu tak juga datang \n Sekalinya datang kok nagih utang,Pantun Jenaka
773,Menantunya pula Lela Sari \n Semua melihat jatuh berahi \n Selagi ugama tidak diingkari \n Sebarang perintah wajib dipatuhi,Pantun Agama
774,Pisau lipat dimainnya kera \n Tangannya luka lalu terjun \n Makan kuat tidak terkira \n Kenyangnya tidak tahi bertimbun? (api),Pantun Teka-Teki
775,Dina merenung suaranya sumbang \n Duduk bersantai dan telah pasrah \n Dia berdengung tapi bukan kumbang \n Punya belalai namun bukan gajah? (Jawabannya: Lebah),Pantun Teka-Teki
776,Berjalan di malam kelam \n Ada baiknya mengajak berteman \n Mengapa pungguk rindukan bulan \n Bunga banyak kembang ditaman,Pantun Perpisahan
777,Kalau tuan pergi ke Tanjung \n Belikan sahaya pisau lipat \n Kalau tuan menjadi burung \n Sahaya menjadi benang pengikat,Pantun Cinta
778,Orang bijak santun bicaranya \n Orang baik santun prilakunya \n Orang pinter cepat berfikirnya \n Orang stress nyetatus melulu kerjanya,Pantun Jenaka
779,Asam kandis asam gelugur \n Ketiga asam si riang-riang \n Menangis mayat di pintu kubur \n Teringat badan tidak sembahyang,Pantun Agama
780,Sungguh nikmat bahagia bersama \n Bersama menghabiskan waktu kosong \n Doa tanpa usaha adalah percuma \n Usaha tanpa doa adalah sombong,Pantun Nasihat
781,Hilir rakit berkajang kain \n Dimana teluk singgah bertimba \n Niatku bukan pada yang lain \n Adinda seorang tiada yang kedua,Pantun Perpisahan
782,Ada soimah \n Megang kayu \n Terus masalah \n buat you?,Pantun Jenaka
783,Kini kita dapat tertawa puas \n Menggapai mimpi dengan bebas \n Asal rajin dan tak malas \n Melanjutkan kemerdekaan dengan tegas,Pantun Kemerdekaan
784,Melukis indah di sehelai kain \n Patut dihargai hasil karyanya \n Jangan pernah meremehkan orang lain \n karena belum tentu kau lebih baik darinya,Pantun Nasihat
785,Ayam jantan si ayam jalak \n Jaguh siantan nama diberi \n Rezeki tidak saya tolak \n Musuh tidak saya cari,Pantun Budi
786,Memasang foto tempatnya di dinding \n Membawa mobil untuk dilelang \n Gajah mati meninggalkan gading \n Manusia mati meninggalkan utang,Pantun Jenaka
787,Kemacetan jalan Jakarta \n bukan karena si Komo lewat \n sejak kita menjalin cinta \n ngelakuin apapun aku jadi makin semangat,Pantun Cinta
788,Burung camar di tepi pantai \n Pantai indah banyak ombaknya \n Jadilah kamu anak yang pandai \n Sudah pasti banyak temannya,Pantun Anak-anak
789,Pohon tinggi jatuh membayang \n jalan setapak dari Ketapang \n Siapa yang rajin sembahyang \n sejuk di hati dadapun lapang,Pantun Nasihat
790,Koar-koar masalah tunjangan \n Sampai-sampai semua tidak sabar \n Coba lihat masalah lingkungan \n Yang rusak karena tercemar,Pantun Alam
791,Pinggir sungai banyak nipah \n sayang airnya terasa sepah \n Kasih sayang semakin berlimpah \n jadikan hidupku semakin indah,Pantun Cinta
792,Bunga cantik namanya seroja \n Hewan lentik namanya rusa \n Jalan-jalan ke mana saja \n Mungkin ke kota atau ke desa,Pantun Anak-anak
793,Buah mangga dipetik Ata \n Mangga mantap itu punya Pak Ari \n Ayo bersama jaga lingkungan kita \n Agar tetap aman dan asri,Pantun Alam
794,Kalau tuan bawa keladi \n Bawa juga sipucuk rebung \n Kalau tuan bijak bestari \n Apa binatang tanduk di hidung? (Jawabannya: Badak),Pantun Teka-Teki
795,Ikan sepat dimasak berlada \n Kutunggu digulai anak seberang \n Jika tak dapat pada masa muda \n Kutunggu sampai beranak seorang,Pantun Cinta
796,Sungguh Tega membuka aib \n Membuat orang menjadi marah \n Jangan putus asa dengan nasib \n Karena nasib bisa diubah,Pantun Nasihat
797,Jika tuan pakai lencana \n Pakailah songkok di atas kepala \n Jika tuan memang bijaksana \n Binatang apakah tak berkepala? (Jawabannya: Ketam/Kepiting/yuyu),Pantun Teka-Teki
798,Artis ngondek \n senyumannya membius \n Ga masalah pendek \n yang penting kamu religius,Pantun Cinta
799,Hujan turun belum reda \n Airnya rembes dari talang \n Berpetualang selagi muda \n Hatimu bebas bagaikan elang,Pantun Anak-anak
800,"Ada budak membuang dedak \n Penuh setimba di celah batu \n Berdua tidak, bertiga pun tidak \n Kekasih hamba hanyalah satu",Pantun Cinta
801,Kalau ada jarum yang patah \n Jangan simpan dalam peti \n Kalau ada kata yang salah \n Jangan simpan dalam hati,Pantun Nasihat
802,Jalan-jalan ke kota paris \n Banyak rumah berbaris-baris \n Biar mati diujung keris \n Asal dapat dinda yang manis,Pantun Jenaka
803,Indah sekali pintu dipahat \n Bergambar daun dan dahan \n Kalau ingin hidup selamat \n Taat selalu perintah tuhan,Pantun Agama
804,Ucapkan kata dengan suara \n Kata jelas suara pun jernih \n Jika bicara lihatlah suasana \n Gunakan kata secara terpilih,Pantun Pendidikan
805,Menek wit pelem ora kudu ahli \n jalaran duwure ranganti rong meter \n Sugeng riyadi Idul Fitri \n donga-dinonga kita satya ning dalan bener,Pantun Bahasa Jawa
806,Burung merpati terbang ke bawa \n Hinggap gembira di pohon mangga \n Murung dihati terkenang ayah \n Mengadap pusara ku mohon doa tiada terhingga,Pantun Ayah
807,Kota bintan banyak perunggu \n kota ciamis membangun tugu \n Janji kenan di malam minggu \n Tapi gerimiz udah menunggu,Pantun Budi
808,Dua Mei hari pendidikan \n Hari lahir Ki Hajar Dewantara \n Jika orang tidak berpendidikan \n Seumur hidup bakal sengsara,Pantun Pendidikan
809,Harban Dewa anaknya Zanggi \n Manis rupanya elok bercahaya \n Jika perempuan taatkan laki \n Beroleh surga Jannatul Mahwa,Pantun Agama
810,Kalau kau pergi ke dusun \n Jangan lupa bawa beras \n Belajarlah dengan tekun \n Supaya kau naik kelas,Pantun Pendidikan
811,Paman sedang menebang bambu \n Untuk tiang bendera \n Dirgahayu Indonesia ku \n Salam Merdekaaaaaa,Pantun Kemerdekaan
812,Nangka muda digulai lemak \n Buah keranji masak tersangkut \n Harta dunia jangan di tamak \n Kalau mati tak akan mengikut,Pantun Agama
813,Terburu-buru ke kamar mandi \n Ternyata lupa membawa sabun \n Coba tebak apakah ini \n Selalu naik tak pernah turun? (Jawabannya: Umur),Pantun Teka-Teki
814,Ikan berenang lubuk \n Ikan belida dadanya panjang \n Adat pinang pulang ke tampuk \n Adat sirih pulang ke gagang,Pantun Adat
815,Buah itu jangan dipetik \n Susah payah saat ditanam \n Engkaulah gadis tercantik \n Kuimpikan siang dan malam,Pantun Cinta
816,Kalau ranting sudah bertangkai \n Janganlah dililit-lilit juga \n Kalau berunding sudah selesai \n Jangan diungkit-ungkit juga,Pantun Nasihat
817,Kain basurek kain bertulis \n Pakaian raja Bugis - Makassar \n Di Luh Mahfuz sudah tertulis \n Janji sudah tak dapat ditukar,Pantun Agama
818,Kemuning di tengah balai \n Bertumbuh terus semakin tinggi \n Berunding dengan orang tak pandai \n Bagaikan alu pencungkil duri,Pantun Nasihat
819,Laksamana berbaju besi \n Masuk ke hutan melanda-landa \n Hidup berdiri dengan saksi \n Adat berdiri dengan tanda,Pantun Adat
820,Hari Minggu cuacanya indah \n Berlibur yang tepat di hari Minggu \n Bapak guru yang terlihat gagah \n Salam hormat kami untukmu,Pantun Guru
821,Ikan berenang kejar sampan \n Mencari sahabat mencari teman \n Tidak kaya tidak tampan \n Tapi kau buatku nyaman,Pantun Cinta
822,Tante Mayang istrinya jaksa \n Membeli bubur dikasih laksa \n Tidak sembahnyang tidak puasa \n Di dalam kubur pasti disiksa,Pantun Agama
823,Tubuh dijirat paduka tuan \n Tidak cacat tidak selia \n Didalam surga ada penantian \n Hanya untuk yang beramal mulia,Pantun Agama
824,Makan buah jeruk rasanya asam \n Sama rasa dengan buah mangga \n Ayo kawan mari lestarikan alam \n Agar bumi selalu terjaga,Pantun Alam
825,Bunga mawar tangkai berduri \n Laris manis pedang cendol \n Aku tersenyum malu sekali \n Ingat dulu suka mengompol,Pantun Jenaka
826,Naik ke bukit membeli lada \n Lada sebiji dibelah tujuh \n Apanya sakit berbini janda \n Anak tiri boleh disuruh,Pantun Jenaka
827,Sungguh indah kerajinan rotan \n Dibuat menarik oleh pengrajinnya \n Mari kita menjaga hutan \n Jangan sampai kita merusaknya,Pantun Alam
828,Setiap pagi makan bubur \n Lengkap dengan segelas susu \n Setiap saat slalu tertidur \n kuingin kau ada di mimpik,Pantun Cinta
829,Minah ketawa terjerit-jerit \n Melihat koyak pada seluar \n Orang putih duduk sederet \n Pagar didalam tebing diluar? (gigi),Pantun Teka-Teki
830,Bunga kenanga di atas kubur \n Pucuk sari pandan Jawa \n Apa guna sombong dan takabur \n Rusak hati badan binasa,Pantun Agama
831,Walau hanya sebuah jambu \n Namun ini bisa diramu \n Walau kita jarang bertemu \n Cinta ini hanya untukmu,Pantun Cinta
832,Sungguh bahaya ular berbisa \n bila tergigit akan koma \n sungguh bahagia kurasa \n bila kita slalu bersama,Pantun Cinta
833,Jangan senang memfitnah orang \n Orang benci Tuhan pun murka \n Jangan senang melalaikan sembahyang \n Jika mati masuk neraka,Pantun Agama
834,Hari minggu sudahlah siang \n Setelah siang menuju petang \n Ditunggu tunggu gak jua datang \n Sekali datang kok nagih utang,Pantun Jenaka
835,Enaknya gulai ditambah roti \n Untuk bekal dalam pedati \n Sudah pandai rendah hati \n Pastilah dia lelaki sejati,Pantun Cinta
836,Single bukanlah takdir \n tapi tangga menuju kedewasaan \n bukalah cinta dari semua tabir \n biar hidupmu dalam lingkup kebahagiaan,Pantun Cinta
837,Ikan belanak hilir berenang \n Burung dara membuat sarang \n Makan tak enak tidur tak tenang \n Hanya teringat dinda seorang,Pantun Cinta
838,Jalan-jalan ke Ciamis \n Ada gedung parkirnya gratis \n Aku cinta sama si kumis \n orangnya ganteng lagi romantis,Pantun Cinta
839,Membaca buku di meja makan \n Setelah dibaca terasa sulit \n Jika cinta tak diungkapkan \n Bersiaplah menerima rasa sakit,Pantun Cinta
840,Gunung Jati anak Rara Santang \n dicintai juga disayang \n Walau banyak godaan datang \n teguh hatiku tak pernah goyang,Pantun Cinta
841,Menendang bola mengenai mistar \n Penonton protes yang tidak perlu \n Jika kau merasa paling pintar \n Kucing apa yang tidak berbulu ? ( Jawabannya : Kucing Sphynx ),Pantun Teka-Teki
842,Cik Limah bersama anak lelaki \n Duduk makan keropok lekor \n Yang mengejar tidak berkaki \n Yang dikejar tiada berekor? (ular dan katak),Pantun Teka-Teki
843,Anjing bermain dengan tali \n Kera duduk membaca koran \n Bagaimana hati tak geli \n Kepala botak suka sisiran,Pantun Jenaka
844,"Hidup Ini Hanya Sementara \n Peluang yang ada digunakan sebaiknya \n I Love U Ayah Selama-Lamanya \n Now I Know, bukan mudah menjadi seorang bapa",Pantun Ayah
845,Banyak bulan perkara bulan \n Tidak semulia bulan puasa \n Banyak tuhan perkara tuhan \n Tidak semulia Tuhan Yang Esa,Pantun Agama
846,Sungguh indah syair setanggi \n Menyusun kata bagai hiasan \n Ilmu itu mesti tinggi \n Jangan dunia sebagai batasan,Pantun Nasihat
847,Hidup aman di dalam kota \n Ada pemimpin bernama raja \n Buruh-buruh rajin bekerja \n Askar bertugas setiap masa (anai-anai/semut),Pantun Teka-Teki
848,Teman kamu apa kabar \n Nyalakan api agar selalu berkobar \n Wahai teman bertahanlah dan bersabar \n Dunia tau mana yang benar,Pantun Bijak
849,"Burung terbang menggunakan sayap \n Terbang tinggi tak ada yang melampaui \n Guru, jangan pernah lelah dan lelap \n Didik kami hingga menjadi orang besar nanti",Pantun Guru
850,Makan semangka \n makan kedondong \n Kalau suka \n nyatain dong,Pantun Cinta
851,Jangan pernah ke selokan \n nanti kotor ditertawakan \n jangan pernah ragukan \n janji setia yg ku ikrarkan,Pantun Cinta
852,Banyak semut diatas papan \n Sedang makan gula-gula \n Selamat menyambut hari kemerdekaan \n Merdeka Merdeka Merdeka,Pantun Kemerdekaan
853,Beli ketan \n beli kain songket \n Biar udah mantan \n kita tetep lengket,Pantun Cinta
854,Menanam kelapa di Pulau Bukum \n Tinggi sedepa sudah berbuah \n Adat bermula dengan hukum \n Hukum bersandar di Kitab Allah,Pantun Adat
855,"Sungguh kusam rumah kosong \n Tidak mencerminkan sebuah kebersihan \n Jangan pernah berlaku sombong \n Karena sombong, awal dari kejatuhan",Pantun Nasihat
856,Kayu cendana di atas batu \n Sudah diikat dibawa pulang \n Adat dunia memang begitu \n Benda yang buruk memang terbuang,Pantun Nasihat
857,Janganlah kau suka mengolok \n Bisa-bisa rugi akhirnya \n Ialah daun tak punya pokok \n Setiap bangunan memilikinya? (Jawabannya: Pintu),Pantun Teka-Teki
858,Burung nuri burung dara \n Terbangnya di sekitar layangan \n Cobalah cari wahai saudara \n makin diisi makin ringan (Jawabannya: Balon),Pantun Teka-Teki
859,Sebuah benda bentuknya bulat \n Ianya ada dari pada besi \n Jika bermain diikat kuat \n Dilempar hidup dipegang mati? (Jawabannya: Gasing),Pantun Teka-Teki
860,Minum kopi bersama nana \n Kopi susu begitu nikmatnya \n Manfaat sehat kita bahagia \n Bisa berhemat dikala muda,Pantun Berbalas
861,Wangi nian kembang kenanga \n Manalah indah pohon ara \n Naik gunung mencari bunga \n Hati senang riang gembira,Pantun Anak-anak
862,"Makan bubur di atas meja \n Minumnya jus di balik rak \n Hari libur terus bekerja \n Dapat bonus ambilnya di ira,  wkwk",Pantun Jenaka
863,Ada orang Bengkulu dijitak \n Di jitak sama orang Batak \n Selama jantungku berdetak \n Cintaku tak akan luluh lantak,Pantun Cinta
864,Harga Ayam tiba-tiba melambung pula \n Macam-macam alasan kononnya \n Kenangan bersama Ayah sukar dilupa \n Mendidik diri q hingga berjaya,Pantun Ayah
865,Makan bubur diatas meja \n Minumnya jus diatas rak \n Hari libur tetap bekerja \n Dapat bonus ambilnya di irak,Pantun Jenaka
866,Sapi putih tarik pedati \n Pedatinya bergoyang-goyang \n Ayah selalu baik hati \n Aku ditimang slalu disayang,Pantun Anak-anak
867,Anak teruna tiba di darat \n Dari Makasar langsung ke Deli \n Hidup di dunia biar beradat \n Bahasa tidak dijual beli,Pantun Adat
868,Masak ayam masak tumis \n Iris tipis sampai habis \n Selasa malam hujannya gerimis \n Dompet tipis makin kritis,Pantun Jenaka
869,Hari jumat hujan lebat \n awan mendung hitam pekat \n rayuanmu sungguh hebat \n mampu membuatku terpikat,Pantun Cinta
870,Pergi ke pasar beli tekwan \n Tapi sayang di panggang jadi item \n Jika kamu penyayang hewan \n Kenapa anak kucing dan anjing suka berantem? ( Jawabannya : Yah namanya juga anak - anak ),Pantun Teka-Teki
871,Kalau ada sumur diladang \n Bolehlah kita menggosok gigi \n Kalau anda diwarung padang \n Bolehkah kita ditraktir lagi,Pantun Jenaka
872,Limau purut lebat di pangkal \n Sayang selasih condong uratnya \n Angin ribut dapat ditangkal \n Hati yang kasih apa obatnya,Pantun Cinta
873,Ulang tahun nenek tanggal 2 \n Dirayakan di hari minggu \n Selamat HUT RI yang ke 72 \n Semoga Indonesia tetap bersatu,Pantun Kemerdekaan
874,Sakit kaki ditikam jeruju \n Jeruju ada di dalam paya \n Sakit hati memandang susu \n Susu ada dalam kebaya,Pantun Jenaka
875,Banyak orang menggali perigi \n Ambil buluh kemudian diikat \n Ilmu dicari tak akan rugi \n Untuk bekal dunia akhirat,Pantun Agama
876,Empek-empek bumbu cuka \n Lezat sekali dirasa lidah \n Ke kota aku sangat suka \n Ke desa pun banyak yang indah,Pantun Anak-anak
877,Terbang tinggi si burung helang \n Hinggap di atas pohon meranti \n Anak ramai ibunya seorang \n Bila bergesel berapi-rapi? (mancis),Pantun Teka-Teki
878,Kolam penuh ikan sepat \n Untuk dimasak di daun talas \n Kalau ingin ilmu manfaat \n Cari guru yang tulus ikhlas,Pantun Nasihat
879,Pohon nangka berbuah lebat \n Bilalah masak harum juga \n Berumpun pusaka berupa adat \n Daerah berluhak alam beraja,Pantun Adat
880,Tempat duduknya sangat tinggi \n Namun ia bernasib malang \n Saat malam ia berseri \n Bila siang ia menghilang? (Jawabannya: Bintang),Pantun Teka-Teki
881,Tari piring tari saman \n Tari lilin apinya berpijar \n Al Quran adalah pedoman \n Rajin-rajinlah engkau belajar,Pantun Nasihat
882,Pagi ini membaca koran \n Baca berita orang hilang \n Bermain kejar-kejaran \n Badan sehat hati pun senang,Pantun Anak-anak
883,Tengoklah burung kutilang \n Terbang tinggi dia pulang \n Mari main dengan senang \n Jadi anak yang periang,Pantun Anak-anak
884,Menanam kelapa di pulau Bukum \n Tinggi sedepa sudah berbuah \n Adat bermula dengan hukum \n Hukum bersandar di Kitabullah,Pantun Adat
885,Pagi hari menonton berita \n Beritanya tentang kematian \n Jangan menangis karena cinta \n Karena cinta butuh pengorbanan,Pantun Cinta
886,Tinggi bayam berjengkal-jengkal \n bayang dijinjing karena ringan \n Kepada Allah bertawakal \n tempat diri mohon pertolongan,Pantun Nasihat
887,Pasang bingkai ketok palu \n Pasang bingkai di rumah Wulan \n Untuk menyapa saya malu \n Apalagi mengajak untuk bekenalan,Pantun Berbalas
888,Harga Ayam tiba-tiba melambung pula \n Macam-macam alasan kononnya \n Kenangan bersama Ayah sukar dilupa \n Mendidik kami hingga berjaya,Pantun Ayah
889,Berenang jauh para ikan \n Mereka bebas hatinya senang \n Badan kurus kurang makan \n Kalau ditiup goyang-goyang,Pantun Jenaka
890,Hidup sederhana selalu hemat \n itulah perintah syariat \n Ayo muslimin dan muslimat \n mari kita keluarkan zakat,Pantun Nasihat
891,Kalau berkitab sambil menulis \n Jangan sampai dawat terbuang \n Kalau bercakap di dalam majelis \n Jangan sampai mengumpat orang,Pantun Nasihat
892,Sarapan pagi sambil baca koran \n Baca berita tentang batu apung \n Bayangkan jika tidak ada hutan \n Banyak air siapa yang menampung,Pantun Alam
893,Jalan-jalan ke pinggir empang \n Nemu katak di pinggir empang \n Hati siapa tak bimbang \n Kamu botak minta dikepang,Pantun Jenaka
894,Pensil baru penghapus baru \n Untuk sambut hari sekolah baru \n Bapak guru dan Ibu guru \n Terima kasih atas semua ilmumu,Pantun Guru
895,Terbang tinggi  burung pelatuk \n Sambil memakan ikan kutuk \n Bahagianya dengarkan atuk \n Berdongeng sampai terbatuk-batuk,Pantun Anak-anak
896,Tanam pula di tepi paya \n Mudah pula mengail ikan \n Membesarkan kita hingga berjaya \n Dengan ilmu terus diamalkan,Pantun Ibu
897,Deras arus Kali Malang \n Naik perahu sangat lama \n Senang hati bukan kepalang \n Kalau cintaku kau terima,Pantun Cinta
898,Masih banyak perjuangan kita \n Ingatlah semangat ketika merdeka \n Satukan hati dan kerahkan usaha \n Agar tercapai jua impian merdeka,Pantun Kemerdekaan
899,Elok berjalan kota tua \n Kiri kanan berbatang sepat \n Elok berbini orang tua \n Perut kenyang ajaran dapat,Pantun Jenaka
900,"Buah manggis buah markisa \n Buah nanas buah pepaya \n Nak, menangislah di hadapan orang tua \n Semoga doa terkabul olehnya",Pantun Bijak
901,Burung pipt burung dara \n Bagus rupanya berwarna warni \n Agar alam tetap terjaga \n Janganlah kita mengotori,Pantun Alam
902,Asam lakum \n batang tabu \n Assamualaikum \n warormatunggalh hiwabarkatu,Pantun Budi
903,Kenanga putih ada di batu \n lalu di tuai dua pemuda \n terima kasih jika begitu \n baru damai rasa di dada,Pantun Budi
904,Bila tuan muda teruna \n Pakai seluar dengan gayanya \n Bila tuan bijak laksana \n Biji di luar apa buahnya? (Jawabannya: Buah Jambu Mete),Pantun Teka-Teki
905,Kalau ada sumur diladang \n Boleh saya menumpang mandi \n Kalau ada umur yang panjang \n Boleh kita berjumpa lagi,Pantun Perpisahan
906,Coba-coba menanam mumbang \n Moga-moga tumbuh kelapa \n Coba-coba bertanam sayang \n Moga-moga menjadi cinta,Pantun Cinta
907,Ini musim masih penghujan \n Kata simbok jangan nakal \n Kalau muslim silahkan Jumatan \n Bawa gembok amankan sendal,Pantun Jenaka
908,Air laut sedang pasang \n Air bisa membuat genangan \n Ikan bernapas dengan insang \n Paus bernapas dengan ? ( Jawabannya : Dengan izin Allah ),Pantun Teka-Teki
909,Tanam padi di tengah sawah \n Sawah subur hasil melimpah \n Pagi hari ke sekolah \n Sore hari ke madrasah,Pantun Pendidikan
910,Ada orang Maluku di jitak \n dijitak sama orang Batak \n selama jantungku masih berdetak \n cintaku tak akan luluh lantak,Pantun Cinta
911,Bunga besar bunga raflesia \n Bunga kecil bunga melati \n Cepatlah taubat wahai manusia \n Jangan menunggu sampai kau mati,Pantun Agama
912,Ke salon creambath \n biar aliran darah lancar \n Bosen ah jadi sahabat \n maunya jadi pacar!,Pantun Cinta
913,Cari lebah bersarang besar \n Jangan tersengat racun berbisa \n Janji Allah adalah benar \n Jangan tertipu kehidupan dunia,Pantun Agama
914,Lagi galau \n dihibur Upin Ipin \n Bagaimana kalau \n kita tukeran Pin?,Pantun Cinta
915,Hari minggu pergi ke museum \n Ke museum lewati hutan pohon cemara \n Cobalah saja dari tersenyum \n Sebelum mencoba untuk berbicara,Pantun Berbalas
916,Terbang tinggi burung nuri \n Hendak menuju negeri peri \n Izinkan aku menjadi bidadari \n Mendampingimu sepanjang hari,Pantun Cinta
917,Beli duku di toko latif \n Membelinya bareng si afif \n Cantik itu memang relatif \n Photoshop jadi alternatif,Pantun Jenaka
918,Pergi ke pasar membeli Kepah \n Untuk dimasak sambal pedas \n Terima Kasih buat Ayah \n Kasih dicurah hanya Tuhan yang mampu membalas,Pantun Ayah
919,Setangkai bunga indah menyihir \n terhirup baunya hati tertawan \n andai kita sudah di takdir \n hidup bersama jadi impian,Pantun Budi
920,Di sana gunung di sini gunung \n Ditengah-tengahnya danau Toba \n Ke sana bingung ke situ bingung \n Lebih baik sekolah saja,Pantun Pendidikan
921,Berakit-rakit ke hulu \n Berenang-renang ketepian \n Ayok berangkat ke penghulu \n Dari pada Cuma temenan,Pantun Jenaka
922,Kancil terikat mulut meronta \n Datang kerbau sama buaya \n Kau membawakan aku cinta \n Ditambah dengan rasa setia,Pantun Cinta
923,Sungguh bahaya ular berbisa \n Jika tergigit akan koma \n Sungguh bahagia terasa \n Bila kita selalu bersama,Pantun Cinta
924,Koran dipakai membungkus ikan \n Ikan pari punya kesaktian \n Bukan hadiah yang kuharapkan \n Cukuplah  engkau beri perhatian,Pantun Cinta
925,Burung perkutut \n burung kutilang \n Kamu kentut \n kagak bilang bilang,Pantun Jenaka
926,Pergi hutan cari herba dan rotan \n pergi bersama pak mahat \n Bangun pagi untuk kesihatan \n pacak sepadu waja tanda sihat,Pantun Budi
927,Mata belo \n ala komedian \n Gue sama elo? \n maunya jadian,Pantun Cinta
928,Kain tenun dari Sumbawa \n Kain batik dari Pekalongan \n Jika ingin jadi mahasiswa \n Sekolah Dasar jangan diabaikan,Pantun Pendidikan
929,Pohon ara dibuat gubuk \n Pasang pasak biar tegak \n Resiko asmara dunia facebook  \n Cinta ditolak blokir bertindak,Pantun Jenaka
930,Limau purut di tepi rawa \n buah dilanting belum masak \n Sakit perut sebab tertawa \n melihat kucing duduk berbedak,Pantun Jenaka
931,Kalau tuan pergi ke Tanjung \n Kirim saya sehelai baju \n Kalau tuan menjadi burung \n Sahaya menjadi ranting kayu,Pantun Cinta
932,Burung terbang di atas turi \n hinggap sebentar di pohon kenari \n Kasih sayangku amatlah murni \n Bagai embun di pagi hari,Pantun Cinta
933,"Marilah bersama bersatu dihati \n Bersama membina bangsa Indonesia \n Impian merdeka belum dikecapi \n Bangun rakyat Indonesia, bangun bersama",Pantun Kemerdekaan
934,Kalau keladi sudah ditanam \n Janganlah lagi meminta talas \n Kalau budi sudah ditanam \n Janganlah lagi meminta balas,Pantun Nasihat
935,"Lupa Rabbi petanda tingkah \n Bicara agama rangkulan taqwa \n Bapa, ayahanda dan abah \n Semesra nama simpulan jiwa",Pantun Ayah
